id,q1,q2,q3,q4,q5,q6,q7,q8,q9,q10,career
1,Computer Science, Mathematics,Coding, building apps, reading tech blogs,Break it down into small parts and solve step-by-step,Flexible, collaborative, and remote-friendly,Logical thinking, programming, debugging,Solving coding challenges, building new apps,Take short breaks, listen to music, focus on one thing at a time,To become a senior software developer or startup founder,Technology, SaaS, startups,Project-based learning, online courses, YouTube tutorials,Software Engineer
2,Statistics, Data Science, Computer Science,Analyzing trends, playing strategy games, reading research papers,Use data and patterns to find optimal solutions,Structured and research-driven,Data analysis, visualization, machine learning,Finding patterns in large datasets,Make a to-do list, prioritize tasks, deep work,To work as a lead data scientist at a major tech company,Finance, Technology, Healthcare,Hands-on experimentation and Kaggle competitions,Data Scientist
3,Psychology, Design, Communication,Sketching, observing user behavior, UI prototyping,Empathize with users and test different prototypes,Creative and collaborative teams,Design thinking, communication, wireframing,Designing intuitive and beautiful user experiences,Talk to friends, take inspiration from nature, go on walks,To lead a UX team at a global design agency,Tech, Design, E-commerce,Learning through design bootcamps and practical work,UI/UX Designer
4,Business Studies, Economics, Psychology,Reading about business trends, networking, strategy games,Think from multiple stakeholder perspectives,Fast-paced and cross-functional teams,Decision-making, leadership, communication,Strategizing product features and leading launches,Delegate, reprioritize, and focus on KPIs,To become a product manager at a global tech firm,Technology, Finance, E-commerce,Case studies, real-world experience, shadowing mentors,Product Manager
5,English, Literature, History,Writing blogs, storytelling, researching history,Break down the topic and create outlines,Quiet and individual-focused workspace,Writing, grammar, creativity,Creating engaging content and narratives,Take a walk, read for inspiration, or free-write,To become a full-time content strategist and author,Publishing, Media, EdTech,Reading books, writing regularly, learning from feedback,Content Writer
6,Computer Science, Physics,Gaming, tinkering with hardware, robotics,Approach problems logically and build test cases,Structured and tech-centric environment,Coding, assembling hardware, troubleshooting,Building IoT devices and seeing them work,Isolate the issue and focus on solving with tools,To work in AI-integrated robotics or embedded systems,Electronics, Defense, Robotics,Hands-on projects, device-based learning,Hardware Engineer
7,Math, Science, Logical Reasoning,Coding, solving DSA problems, participating in hackathons,Use pseudocode and dry-run for logical flows,Quiet and technically focused teams,Problem-solving, algorithm design,Debugging complex algorithms,Focus on breathing, walk away then come back fresh,To crack top product-based company interviews,Tech, Research, Fintech,Competitive coding, algorithm books,Software Engineer
8,Computer Science, AI, Math,Watching AI tutorials, building chatbots,Experiment, analyze failures, and improve,Futuristic and innovation-driven space,ML algorithms, data preprocessing,Creating predictive models with high accuracy,Take a break, rethink with a notebook,To build ethical and impactful AI solutions,AI, Finance, Healthcare,Online AI courses, applied ML labs,Data Scientist
9,English, Design, Psychology,Watching movies, writing reviews, designing covers,Research user behavior and brainstorm ideas,Friendly and open-minded workspaces,Creativity, writing, aesthetics,Designing storyboards and graphics,Take deep breaths, sketch random ideas,To work in media agencies or advertising firms,Media, Advertising, Creative,Workshops, mentor feedback,Graphic Designer
10,Finance, Business Studies, Analytics,Case competitions, stock trading,Read and interpret financial data thoroughly,Corporate and analytic environment,Analytics, data modeling, excel tools,Creating reports and forecasting trends,Break tasks down and follow plans,To work as a business analyst in an MNC,Finance, Consulting, Business,Work with datasets, case studies,Business Analyst
11,Computer Science, IT,Software tinkering, open source,Read documentation, trial & error,Remote and independent,Full-stack development,Designing scalable systems,Use music and to-do apps to stay calm,Build own SaaS product,Tech, Web, Startups,YouTube, open source, mentors,Software Engineer
12,Statistics, Economics, Data Science,Building dashboards, learning Tableau,Explore insights using graphs,Quiet and analytical spaces,Data analysis, business intelligence,Dashboard creation,Focus on goal and break work into time blocks,Become a BI expert in a Fortune 500 company,Healthcare, Analytics, Government,MOOCs, use BI tools,Data Analyst
13,Psychology, Sociology, Philosophy,Listening to podcasts, writing essays,Understand different perspectives,Individual and flexible workspace,Writing, researching,Empathic storytelling,Take time for self-reflection,Become a behavioral researcher or author,Healthcare, NGOs, Publishing,Books, discussions, research papers,Content Writer
14,Computer Science, Cyber Law,Hacking CTFs, security news,Investigate vulnerabilities systematically,Secured and ethical workspaces,Penetration testing, security auditing,Finding security loopholes,Use Pomodoro and isolation,To become a cybersecurity analyst,Defense, Finance, Tech,Capture the Flag contests, labs,Cybersecurity Specialist
15,Visual Arts, Design, Communication,Illustrating, animation,Brand-based ideation,Studio-like creative teams,Design, visual storytelling,Creating motion graphics,Play music or walk,Senior designer in a film studio,Media, Entertainment, Films,Animations, courses,Graphic Designer
16,Business Studies, Law, Communication,Debating, public speaking, strategic thinking,Frame problem as a negotiation,Fast-paced and leadership-driven,People skills, market understanding,Organizing, pitching,Reframe goals, consult mentors,Start a firm or lead a product team,Business, Tech, Media,Networking, business cases,Product Manager
17,History, Political Science, English,Reading news, writing essays,Make timelines and cross-verify facts,Focused and disciplined spaces,Research, writing, analysis,Curating historic documentaries,Take a break, discuss with peer,Become an academic historian,Education, Publishing, Museums,Lectures, academic papers,Content Writer
18,Computer Science, AI,Coding bots, AI challenges,Prototype and test different models,Tech-forward and autonomous setups,Coding, AI training,Implementing neural networks,Take 10-minute meditative breaks,AI engineer in a research lab,AI, Health, Automation,Research papers, AI mentors,Data Scientist
19,Marketing, Design, Psychology,Designing ads, analyzing campaigns,Use persona mapping and A/B testing,Creative marketing teams,Campaign design, strategy,Running successful digital campaigns,Unplug, recharge, then rework,Marketing head at FMCG,Advertising, E-commerce,Digital marketing bootcamps,Digital Marketer
20,Computer Science, App Dev,Coding mobile UIs, testing apps,Use design systems and iterate quickly,Product-based teams,Flutter, APIs, UI integration,Launching new features,Switch task to UI design briefly,App CTO or tech lead,E-commerce, SaaS,Web tutorials, GitHub code,Flutter Developer
21,Computer Science, AI, Coding competitions, AI podcasts,Divide into logic blocks and iterate,Independent and focused,Python, TensorFlow, problem-solving,Model training, test analysis,Work in sprints, break down big tasks,Build AI-powered SaaS tools,AI, Robotics, Healthcare,Deep learning courses, real-time projects,Data Scientist
22,Biology, Chemistry, Environmental Science,Gardening, eco blogs, documentaries,Investigate cause-effect and solutions,Nature-connected and ethical environment,Research, observation, data collection,Exploring environmental impact,Talk to mentor or take a walk,Work in climate change research,Environment, Science, NGOs,Research papers, TED talks,Environmental Scientist
23,Finance, Economics, Mathematics,Stock analysis, finance games, spreadsheet work,Use formulas and model real scenarios,Team-oriented and analytical,Forecasting, data visualization,Portfolio optimization,Take a walk and reorganize priorities,Become a quantitative analyst,Finance, Fintech, Analytics,Finance courses, case studies,Quant Analyst
24,Design, Communication, Sociology,Creating brand stories, drawing,Map out user journey, test ideas,Design-led startup culture,Visual design, storytelling,Ad design and concept art,Switch to music or fresh air,Lead creative at branding agency,Marketing, Design, Advertising,Campaign analysis, YouTube,Graphic Designer
25,Mathematics, Computer Science, Physics,Competitive coding, algorithm books,Apply math to simplify the problem,Structured and logic-driven,Algorithms, code optimization,Solving time-bound coding problems,Change work setting briefly,Work at top-tier coding companies,Tech, Research, Security,Competitive platforms,Software Engineer
26,Psychology, Communication, Marketing,Storytelling, vlogging,Understanding human behavior and testing solutions,Collaborative creative teams,Content ideation, copywriting,Generating ad ideas,Talk to a peer or write freely,Head of marketing or content,Media, EdTech, Communication,Social media bootcamps,Digital Marketer
27,Business Studies, Economics, Strategy,Startup podcasts, case study analysis,Model decisions like a simulation,Fast and goal-focused team,Leadership, communication, roadmap building,Organizing business models,Pause, reflect and journal thoughts,Create a B2B SaaS startup,Business, Tech, Strategy,Business books, mentors,Product Manager
28,Law, Political Science, History,Debating, following legal proceedings,Use logic and law structure,Formal and structured teams,Legal writing, logical reasoning,Building structured arguments,Breathe and take breaks between cases,Become a legal tech consultant,LegalTech, Government, AI,Case studies, law books,Legal Analyst
29,Computer Science, Networking,Hacking, configuring routers,Start from OSI layers and logs,Secure and technically oriented,Networking tools, server setups,Troubleshooting connections,Scan documentation or try test cases,Build secure corporate networks,Telecom, Cybersecurity, Networking,Certifications, hardware labs,Network Engineer
30,Physics, Electronics, Math,Building circuits, tech forums,Use physics laws for predictions,Lab and team-focused environment,Circuit design, debugging,Experimenting with IoT,Work through trial and error,Join an IoT hardware startup,Electronics, Robotics, Research,Tech forums, datasheets,Hardware Engineer
31,Communication, English, Journalism,Podcasting, public speaking,Break it into key messages,Fast-paced creative spaces,Public speaking, research,Storytelling and creating impact stories,Take voice notes or journal,Anchor in national broadcast,Media, Journalism, PR,Workshops, articles,Journalist
32,Maths, Finance, Logic,Solving puzzles, stock predictions,Think in spreadsheets and charts,Finance-first corporate teams,Analytics, calculation speed,Creating financial strategies,Use planners and focus music,Join Fintech analytics team,Finance, Crypto, Banking,Excel and market sim tools,Financial Analyst
33,Design, Computer Science, Art,Web UI design, animations,Redesign prototypes after testing,Startup or agency setup,Front-end, UX flow,Designing web experiences,Pause with visual exploration,Work at design-centric startups,Tech, Design, Fashion,Behance, Dribbble,UI/UX Designer
34,Biology, Chemistry, Physics,Lab research, medical reading,Form hypothesis and experiment,Research-based settings,Lab analysis, biology tools,Running tests and data logs,Deep breathing and step-by-step retry,Work in biotech innovation,Healthcare, Pharma, Research,Research databases,Biotech Researcher
35,Programming, Data Structures, Algorithms,Leetcode, GitHub projects,Solve via recursion or greedy methods,Quiet and solo-friendly,Optimization, logic puzzles,Coding for time and space constraints,Do a different logic game,Join competitive coding teams,Fintech, Tech, SaaS,DSA bootcamps,Software Engineer
36,Management, Leadership, Psychology,Organizing events, team leads,Build steps with deadlines and people involved,Goal-driven fast workplaces,Strategy, collaboration,Team direction,Schedule Pomodoros and organize,Become a business strategist,Management, Product, Consulting,Startup case studies,Product Manager
37,English, Communication, Literature,Writing stories, blogs,Think of story arcs, analogies,Quiet, content-driven workplaces,Writing, editing, storytelling,Creating compelling narratives,Take a walk and brainstorm,Publish a book or lead content team,Media, Writing, EdTech,Medium, Grammarly,Content Writer
38,Physics, Math, Engineering,Simulations, 3D modeling,Apply physics simulations and models,Lab-friendly collaborative setups,Modeling, equations, data science,Build engineering models,Use visual representations,Work at aerospace or space tech,Aerospace, Defense, Research,Simulations, modeling tools,Aerospace Engineer
39,IT, Cloud Computing, DevOps,Docker, AWS projects,Divide into services and automate,Remote DevOps teams,Containerization, automation,Deploying at scale,Walk and rethink infrastructure,Cloud engineer or architect,Cloud, SaaS, Infrastructure,Docs, AWS certs,Cloud Engineer
40,Graphic Design, Motion, Storytelling,Animation, filmmaking, storyboards,Sketch story arcs and animate,Creative media spaces,Illustration, animation,Animating scenes,Sketch or storyboard ideas,Work in entertainment studios,Media, Animation, Film,Animation schools,Graphic Designer
41,Computer Science, AI, Machine Learning,Coding bots, AI articles,Read error logs and optimize logic,Remote and focused teams,Python, deep learning, model tuning,Creating real-time ML solutions,Meditation and mind-mapping,Build AI tools for healthcare,AI, Health, Robotics,Courses and coding practice,ML Engineer
42,Finance, Economics, Accounting,Managing expenses, budgeting apps,Analyze spending patterns and model outcomes,Formal and data-driven,Accounting, auditing, forecasting,Creating profit-loss sheets,Prioritize tasks and log progress,Become a chartered accountant,Finance, Banking, Insurance,Finance certifications,Accountant
43,Design, Psychology, Art,Poster designing, watching design breakdowns,Focus on user reaction and rework,Creative collaborative space,Wireframes, creativity, empathy,Designing emotional visuals,Sleep on it and brainstorm again,Design immersive product visuals,Design, Branding, Tech,Portfolio feedback,UI/UX Designer
44,Computer Science, Networks, Cybersecurity,Hacking labs, Kali Linux,Trace attack paths and simulate threats,Highly secure digital setups,Ethical hacking, scripting, pen testing,Simulating intrusion attempts,Walk away and plan next steps,Lead a cybersecurity ops team,Defense, Finance, Tech,Hacking courses, labs,Cybersecurity Analyst
45,English, History, Philosophy,Writing essays, reading historical fiction,Break topic into timeline and viewpoints,Calm and resource-rich libraries,Research, analysis, interpretation,Writing research-driven essays,Make mind maps, stay hydrated,Author or literature professor,Academics, Literature, Journalism,Classic readings, notes,Literature Expert
46,Physics, Math, Astronomy,Stargazing, simulations, physics puzzles,Apply laws to design models,Lab-based observatory setups,Astrophysics, math modeling,Modeling celestial mechanics,Breathing techniques and planning,Work at space research organizations,Astronomy, Aerospace, Education,Simulations, lectures,Astronomer
47,Marketing, Communication, Business,Brand building, ad testing, consumer behavior,Apply psychology of consumer decisions,Diverse and idea-rich teams,Strategy, social campaigns,Optimizing engagement,Unplug briefly or get peer input,Head of digital marketing,Media, Fashion, Retail,Workshops, SEM tools,Marketing Strategist
48,Math, Data Science, Programming,Python scripting, visualizing data,Use libraries to compare patterns,Calm and data-centric offices,Data wrangling, plots, insights,Analyzing graphs and trends,Make small wins and pause,Build decision-making tools,Analytics, Healthcare, Tech,Code and data labs,Data Analyst
49,Biology, Chemistry, Psychology,Experimenting, reading case studies,Form hypotheses and observe reactions,Research-based teams,Observations, notes, hypothesis testing,Running social lab experiments,Deep focus and mindfulness,Behavioral research expert,Psychology, Health, Neuroscience,Case-based learning,Researcher
50,Computer Science, Web Dev,Coding UIs, animations, debugging UI bugs,Test UI/UX flows and get feedback,Agile front-end teams,React, CSS, APIs,Responsive UI creation,Work on different screen sizes,Frontend tech lead,Tech, E-commerce, SaaS,Code-alongs and live demos,Front-End Developer
51,Business, Strategy, Communication,Presenting pitches, strategy boards,Break into steps and measure outcomes,Vision-driven startup teams,Planning, roadmaps, team direction,Pitching and validating business models,Whiteboard strategy and revisit goals,Build a venture studio,Startups, Consulting, Product,Strategic simulations,Product Manager
52,IT, Networking, Security,Server setups, router configs, trace routes,Check protocols and trace logs,On-site tech environments,Server management, logs,Troubleshooting networks,Shut system down and review steps,Network admin for enterprise,IT, Cybersecurity, Infra,Certifications and labs,System Administrator
53,Environmental Science, Geography, Sociology,Hiking, clean-up drives,Report and visualize environmental impact,Field-based flexible roles,Soil, water, pollution metrics,Recording field data,Journal and field photography,NGO work in sustainability,Environment, NGOs, EdTech,Workshops, fieldwork,Environmental Consultant
54,Commerce, Finance, Accounting,Handling ledgers, tally,Use laws of balance sheets and tax logic,Teamwork in regulated setting,Ledger balancing, tax filing,Preparing annual reports,Revisit previous filings,Lead finance team in a firm,Accounting, Banking, Retail,Practice books,Accounting Officer
55,Computer Science, AI, Robotics,Building bots, drone coding,Simulate real-world actions and debug,Futuristic and engineering-focused,Robot control, Python, hardware,Running automation sequences,Take a walk and rewire tasks,AI-robotics integrations,Automation, Defense, R&D,YouTube projects, ML-Robotics Engineer
56,Statistics, Economics, Computer Science,Model predictions, charts,Compare models and iterate on RMSE,Stats-heavy analytics teams,Data modeling, feature selection,Improving forecast accuracy,Refresh perspective and test cases,Join economic modeling teams,Finance, Govt, Analytics,Projects and dataset practice,Econometrician
57,Art, Media, Film,Video editing, direction breakdowns,Segment timelines, storyboards,Creative and tech-rich studios,Motion, editing, pacing,Editing video narratives,Walk or watch short clips,Edit Netflix-style trailers,Media, Entertainment, Film,Video bootcamps,Video Editor
58,Law, Psychology, Sociology,Case reviews, courtroom shows,Trace the logic and legal psychology,Formal and analytical groups,Legal logic, case analysis,Evaluating witness behavior,Pause and restructure thoughts,Lead legal insights team,LegalTech, Crime, Consulting,Legal debates, logic games,Legal Consultant
59,Software Engineering, Cloud, DevOps,CI/CD setups, Docker, Jenkins,Automate steps and monitor logs,Cloud-native fast-paced teams,Container orchestration, scaling,Deploying scalable apps,Take deep breaths and monitor,Join cloud-native product teams,Cloud, DevOps, SaaS,Certifications and labs,DevOps Engineer
60,History, Literature, Communication,Script writing, story-based learning,Timeline and impact-based approach,Independent and creative writing zones,Historical analysis, writing,Documenting time-based narratives,Discuss with peer or
61,Computer Science, App Development, UI Design,Building Flutter apps, app testing,Break features into components and debug,Fully remote, collaborative teams,Dart, UI optimization,Mobile screen adjustments,Take a break or test on device,Build B2C mobile apps,App Dev, Tech, SaaS,YouTube builds,Flutter Developer
62,Electronics, Robotics, Programming,Assembling kits, Arduino,Break into micro-level code and test,Lab and maker-friendly spaces,Sensor integration, GPIO programming,Circuit testing and loops,Take power nap and rewire logic,Build home automation bots,IoT, Robotics, Smart Home,Microcontrollers practice,Embedded Systems Engineer
63,Biology, Psychology, Sociology,Volunteering, behavior studies,Understand human behavior using patterns,Calm, socially interactive setups,Behavior analysis, empathy,Tracking response behavior,Talk to someone or meditate,Work in neuro-therapy labs,Healthcare, Research, Therapy,Clinical case studies,Neuroscience Researcher
64,Computer Science, Backend Dev, APIs,Building REST APIs, Postman tests,Write logic-first functions and validate,Backend-first agile teams,Database, NodeJS, Postgres,Writing scalable endpoints,Play instrumental music or walk,Become a microservice architect,Tech, SaaS, Cloud,API docs,Backend Developer
65,Commerce, Business, Analytics,Handling financial models, reading case studies,Map revenue sources and growth logic,Analytical team culture,Excel models, charts, growth metrics,Forecasting market data,Rebuild spreadsheets with clarity,Lead data-informed startup,Consulting, Startups, Biz Dev,Strategy courses,Business Analyst
66,Political Science, Economics, Public Admin,Policy debates, news reports,Break issues by stakeholders and outcomes,Govt or policy think-tanks,Policy design, governance,Policy frameworks, news impact,Take a walk and reframe problem,Work in government innovation,Govt, NGOs, Policy,Case debates,Policy Analyst
67,IT, AI, Computer Vision,Training object detectors, AI forums,Feed clean images and tune hyperparams,Fast-paced AI research teams,Image labeling, model tuning,Object detection validation,Take feedback and retry,Build visual AI tools,AI, Retail, Security,Dataset prep,Computer Vision Engineer
68,Psychology, Counseling, Communication,Mentoring friends, mental health videos,Understand emotional context and redirect,Empathetic and safe spaces,Empathy, listening, case analysis,Counseling simulation,Take long break or reflect,Open own counseling practice,Therapy, NGOs, Clinics,Casebooks, certified courses,Counselor
69,Chemistry, Pharma, Biology,Lab experiments, organic mix design,Apply balanced reactions and yield theory,Highly controlled lab setup,Chemistry reactions, distillation,Testing yield percent,Recheck steps and tools,Research in medicinal chemistry,Pharma, Health, Biotech,Research papers,Chemist
70,Computer Science, Full Stack Dev, Design,Building clones, experimenting UI,Break into components and APIs,End-to-end product team,React, Express, MongoDB,Full-stack builds,Pause and review from UI,Build SaaS MVPs for startups,Tech, SaaS, Freelance,Tutorials and clones,Full Stack Developer
71,Math, Statistics, Algorithms,Modeling complex logic, math puzzles,Derive patterns using mathematical models,Quiet problem-solving zones,Formulas, derivation, graphs,Solving algorithmic problems,Change approach or simplify,Work on large-scale systems,Fintech, AI, Crypto,Problem-solving sites,Algorithm Engineer
72,Business, Marketing, Branding,Logo design, pitch decks,Map brand emotion and audience,Agile creative teams,Strategy, engagement, storytelling,Running social campaigns,Talk to team or walk out,Build brand identities,Advertising, Media, Marketing,Branding books,Brand Strategist
73,Geography, Environmental Science, Biology,Mapping landscapes, climate tracking,Use GIS tools to analyze terrain,Field-data collection teams,Climate mapping, GIS tools,Environmental impact reports,Take deep breath and go outdoors,Join a geospatial startup,GeoTech, NGOs, Climate,GIS tutorials,Geospatial Analyst
74,Music, Media, Arts,Editing sounds, producing music,Break tempo and layers, adjust rhythm,Studio and music-lab setups,Sound engineering, mixing,Creating audio scenes,Take nap and recompose,Build music for OTT series,Media, Film, Music,DAW and sample packs,Sound Designer
75,Computer Science, Database Systems, Logic Design,Modeling schemas, writing queries,Normalize and structure table logic,DB-focused data teams,SQL, indexing, performance,Query optimization,Work on ER diagrams again,Database architect role,Cloud, Finance, Enterprise,DBMS practice,Database Engineer
76,Design, Animation, Storyboarding,2D sketching, frame-by-frame work,Build narrative from character POV,Creative animation teams,Sketch, animate, color,Animated visual storytelling,Sketch draft then refine,Work on TV or OTT studios,Media, Entertainment, Film,Animation tools,Animator
77,Mechanical, Physics, CAD,Designing parts, AutoCAD simulations,Break into constraints and test limits,Lab or design workshops,CAD, Solidworks, 3D printing,Model prototyping,Pause to test again,Design robotic/mechanical parts,Manufacturing, Robotics, CAD,CAD tutorials,Mechanical Design Engineer
78,Economics, Finance, Data Science,Stock analytics, dashboards,Use regressions to predict change,Data-led analytics firms,Time series, indicators,Forecasting inflation,Analyze volatility and pause,Join fintech or RBI teams,Finance, Govt, FinTech,Econ courses,Economic Analyst
79,English, Media, Scriptwriting,Writing scenes, show formats,Build character arcs and tone,Storyboarding and writing teams,Story plots, narrative arcs,TV storytelling,Take walk and rewatch old scenes,Write drama for OTT,Media, TV, Film,Scriptwriting workshops,Screenwriter
