143,Genetics and Biotechnology,Gene editing experiments and biotech startup research,Design precise experiments with control groups,Biotechnology lab with advanced equipment,Genetic analysis and biotechnology applications,Developing treatments through genetic engineering,Maintain detailed logs and consult with team,Lead genetic research for medical applications,Healthcare and biotechnology,Genetics research and biotech industry trends,Genetic Engineer
144,Supply Chain Management and Logistics,Supply chain simulation and process optimization,Model different scenarios and identify bottlenecks,Logistics company with global operations,Process optimization and logistics planning,Creating more efficient supply chains,Break complex systems into manageable components,Lead supply chain strategy for major corporations,Manufacturing and retail,Supply chain case studies and logistics simulations,Supply Chain Strategist
145,Virtual Reality and User Experience,VR prototyping and user behavior studies,Test with users and iterate on feedback,Tech company with immersive technology focus,3D design and human-computer interaction,Creating immersive experiences that feel natural,Take breaks to experience other VR applications,Develop groundbreaking VR applications,Gaming and education,VR development workshops and UX research,VR Experience Designer
146,Clinical Psychology and Neuroscience,Therapy practice and brain function research,Combine scientific research with therapeutic approaches,Clinical setting with research capabilities,Psychological assessment and therapeutic techniques,Helping people overcome mental health challenges,Practice self-care and maintain professional boundaries,Run a specialized therapy practice with research focus,Healthcare and research,Clinical psychology training and neuroscience research,Clinical Neuropsychologist
147,Sustainable Agriculture and Biology,Permaculture design and soil microbiology research,Apply ecological principles to food production,Experimental farm with research facilities,Ecological analysis and agricultural techniques,Developing sustainable food production systems,Connect with nature and observe natural patterns,Lead agricultural innovation programs,Agriculture and environmental science,Permaculture design courses and agricultural research,Sustainable Agriculture Specialist
148,Robotics and Human-Computer Interaction,Building interactive robots and studying human responses,Design iterative prototypes and gather user feedback,Robotics lab with human studies capability,Robotic design and user interaction analysis,Creating robots that interact naturally with humans,Take breaks to observe human behavior patterns,Develop next-generation interactive robots,Technology and healthcare,Robotics engineering and human factors research,Human-Robot Interaction Designer
149,Telecommunications and Network Engineering,Network architecture design and communication protocol testing,Break down network problems into protocol layers,Telecommunications company with R&D division,Network design and protocol implementation,Building reliable communication systems,Systematically isolate and test components,Lead telecommunications infrastructure projects,Technology and communications,Network engineering certifications and protocol design,Telecommunications Engineer
150,Immunology and Virology,Vaccine research and immune response studies,Design controlled experiments with clear hypotheses,Medical research lab with advanced equipment,Immune system analysis and viral pathology,Developing treatments for infectious diseases,Take methodical notes and consult with colleagues,Lead vaccine development research,Healthcare and pharmaceutical,Immunology journals and laboratory techniques,Vaccine Researcher
151,Astronomy and Astrophysics,Telescope observations and cosmic phenomena modeling,Apply physics principles to astronomical data,Observatory with data analysis capabilities,Astronomical observation and data analysis,Discovering patterns in cosmic phenomena,Take time to contemplate the broader implications,Lead research on specific astronomical questions,Research and education,Astrophysics courses and observational practice,Astrophysicist
152,Industrial Design and Engineering,Product prototyping and user testing,Iterate through multiple designs based on constraints,Design studio with prototyping facilities,3D modeling and materials knowledge,Creating products that are both functional and appealing,Build quick prototypes to test concepts,Design innovative consumer products,Manufacturing and technology,Industrial design projects and engineering principles,Industrial Designer
153,Digital Forensics and Cybersecurity,Digital evidence analysis and security breach simulation,Follow methodical investigation processes,Security operations center with forensics lab,Digital investigation and security analysis,Uncovering digital evidence and preventing breaches,Maintain detailed documentation and verification,Lead digital forensics for major organizations,Law enforcement and technology,Forensics certifications and security practice,Digital Forensics Investigator
154,Conservation Biology and Ecology,Wildlife tracking and habitat restoration,Gather field data and analyze ecosystem relationships,Conservation organization with field operations,Ecological assessment and conservation planning,Preserving biodiversity and restoring ecosystems,Spend time in nature to maintain perspective,Lead major conservation projects,Environmental organizations and research,Field ecology techniques and conservation biology,Conservation Biologist
155,Technical Writing and Computer Science,Documentation creation and software testing,Break complex concepts into clear explanations,Software company with documentation team,Technical communication and software understanding,Creating documentation that makes technology accessible,Get feedback from non-technical readers,Lead documentation for major tech products,Technology and publishing,Technical writing courses and software knowledge,Technical Documentation Specialist
156,Biomedical Engineering and Healthcare,Medical device prototyping and clinical testing,Design solutions based on healthcare needs,Medical technology company with R&D lab,Medical device design and clinical requirements,Developing technology that improves patient care,Consult with healthcare professionals for feedback,Develop innovative medical technologies,Healthcare and technology,Biomedical engineering projects and clinical exposure,Biomedical Engineer
157,Criminology and Psychology,Crime pattern analysis and behavioral profiling,Look for behavioral patterns and motivational factors,Law enforcement agency with research division,Criminal behavior analysis and pattern recognition,Understanding the factors that contribute to crime,Maintain emotional distance while being thorough,Advise law enforcement on complex cases,Law enforcement and research,Criminology studies and behavioral psychology,Criminal Profiler
158,Linguistics and Machine Translation,Language pattern analysis and translation algorithm testing,Break down language structures across cultures,Technology company with linguistics focus,Linguistic analysis and algorithm development,Improving machine translation accuracy,Compare results with human translators,Lead machine translation research,Technology and language services,Computational linguistics and multiple languages,Translation Technology Researcher
159,Civil Engineering and Disaster Resilience,Infrastructure modeling and natural disaster simulation,Apply engineering principles to safety challenges,Engineering firm with disaster planning focus,Structural analysis and resilience planning,Designing infrastructure that withstands disasters,Focus on critical safety factors first,Lead disaster-resistant infrastructure projects,Construction and public safety,Civil engineering and disaster management studies,Resilience Infrastructure Engineer
160,Personal Finance and Behavioral Economics,Financial planning simulations and behavioral studies,Analyze how psychology affects financial decisions,Financial advisory firm with research component,Financial analysis and behavioral insights,Helping people make better financial decisions,Step back to consider psychological factors,Develop innovative financial education programs,Financial services and education,Behavioral economics research and financial planning,Financial Behavior Specialist
161,Artificial Intelligence and Robotics,Building autonomous robots and participating in AI competitions,Decompose complex tasks into smaller robotic functions,Innovation lab with robotics testing facilities,Algorithm design and robotic control systems,Creating robots that can learn and adapt,Test one component at a time with systematic debugging,Develop groundbreaking AI-powered robotics,Technology and automation industries,Robotics workshops and neural network research,Robotics AI Specialist
162,Urban Planning and Environmental Science,Sustainable city modeling and community garden projects,Analyze urban data and simulate environmental impacts,City planning office with environmental focus,Urban analysis and sustainability assessment,Designing cities that work with nature,Take walking tours of neighborhoods to gain perspective,Create sustainable urban development plans,Government and architecture firms,Urban studies and environmental planning courses,Sustainable Urban Planner
163,Web Development and User Experience,Building interactive websites and A/B testing interfaces,Break down user journeys and test different approaches,Technology company with user-centric culture,Frontend development and usability testing,Creating seamless digital experiences,Take breaks and test on different devices,Lead web development for innovative companies,Technology and e-commerce,Web development bootcamps and UX research,Frontend Web Developer
164,Microbiology and Genetics,Laboratory experiments and reading scientific journals,Conduct controlled experiments with clear variables,Research laboratory with advanced equipment,Microbiological analysis and genetic sequencing,Discovering new microbial properties,Maintain detailed notes and consult colleagues,Research microbial solutions for environmental issues,Biotechnology and healthcare,Laboratory techniques and scientific literature reviews,Microbiologist
165,Philosophy and Ethics,Writing essays and debating ethical dilemmas,Analyze arguments from multiple philosophical traditions,Academic institution with interdisciplinary approach,Critical thinking and ethical reasoning,Exploring complex philosophical questions,Take walks to process thoughts and journal ideas,Teach ethics and publish philosophical works,Education and public policy,Philosophy readings and ethical case studies,Ethics Consultant
166,Materials Science and Engineering,Testing material properties and developing composites,Analyze material structure and predict performance,Research and development laboratory,Materials testing and structural analysis,Developing materials with specific properties,Change perspective and review fundamental principles,Develop advanced materials for sustainable applications,Manufacturing and aerospace,Materials science courses and laboratory experiments,Materials Engineer
167,Culinary Arts and Nutrition,Recipe development and food science experiments,Balance flavor profiles and nutritional requirements,Creative kitchen with nutritional research focus,Cooking techniques and nutritional analysis,Creating dishes that are both delicious and nutritious,Step away and return with fresh perspective,Open a restaurant focused on healthy cuisine,Food service and health industry,Culinary school and nutrition studies,Culinary Nutritionist
168,Electrical Engineering and Renewable Energy,Building solar systems and testing energy efficiency,Apply electrical principles to renewable challenges,Engineering firm with sustainability focus,Circuit design and energy systems analysis,Creating more efficient renewable energy systems,Break complex problems into circuit components,Lead renewable energy integration projects,Energy sector and green technology,Electrical engineering and renewable energy studies,Renewable Energy Specialist
169,Animation and Storytelling,Character animation and storyboard creation,Build story arcs and develop character movements,Animation studio with creative freedom,Character design and animation techniques,Bringing characters to life through movement,Watch reference animations and take inspiration breaks,Work for major animation studios,Entertainment and media,Animation courses and storytelling workshops,Character Animator
170,Quantum Physics and Computing,Quantum algorithm design and physics experiments,Apply quantum mechanics to computational problems,Research institution with quantum facilities,Quantum theory and algorithm development,Solving problems using quantum approaches,Take breaks to clarify thought processes,Advance the field of quantum computing,Research and technology,Quantum physics and computational theory courses,Quantum Physicist
171,Social Work and Psychology,Community outreach and counseling practice,Consider individual needs within social contexts,Community service organization with clinical focus,Counseling and community resource navigation,Helping people overcome life challenges,Practice self-care and maintain boundaries,Lead social service programs,Non-profit and healthcare,Social work training and psychology studies,Clinical Social Worker
172,Artificial Intelligence and Healthcare,Medical AI research and health data analysis,Apply machine learning to medical diagnostics,Healthcare technology company with AI focus,Medical data analysis and AI model development,Developing AI systems that improve diagnoses,Review medical literature and consult with doctors,Create AI-powered medical diagnostic tools,Healthcare and technology,Medical AI research and healthcare datasets,Medical AI Researcher
173,Photojournalism and Visual Storytelling,Documentary photography and photo essay creation,Capture defining moments and build visual narratives,News organization with field assignments,Photography and narrative composition,Telling powerful stories through images,Take different angles and review compositions,Work for major news publications,Media and journalism,Photography workshops and storytelling practice,Photojournalist
174,Chemical Engineering and Pharmaceuticals,Drug synthesis and manufacturing process design,Apply chemical principles to pharmaceutical production,Pharmaceutical company with research division,Chemical process design and pharmaceutical knowledge,Developing more efficient drug manufacturing methods,Break complex problems into reaction steps,Lead pharmaceutical production innovation,Healthcare and pharmaceutical,Chemical engineering and pharmaceutical studies,Pharmaceutical Process Engineer
175,International Business and Languages,Cross-cultural business analysis and language learning,Consider cultural contexts and business principles,Multinational corporation with global teams,Cross-cultural communication and business strategy,Developing international business relationships,Practice mindfulness and consider multiple perspectives,Lead international operations for global companies,Business and international trade,International business courses and language immersion,International Business Developer
176,Network Security and Ethical Hacking,Penetration testing and security analysis,Think like an attacker to find vulnerabilities,Cybersecurity firm with testing environment,Network analysis and security protocols,Identifying and fixing security weaknesses,Take breaks to approach problems with fresh perspective,Lead security operations for major organizations,Technology and defense,Security certifications and ethical hacking practice,Penetration Tester
177,Astronomy and Space Science,Telescope observations and astronomical modeling,Apply physics to cosmic phenomena,Observatory with research capabilities,Astronomical observation and data analysis,Discovering patterns in the cosmos,Step back to consider broader implications,Conduct research on astronomical phenomena,Research and aerospace,Astronomy courses and observational practice,Astronomer
178,Structural Engineering and Architecture,Building design and structural analysis,Balance aesthetic design with structural integrity,Engineering firm with architectural collaboration,Structural calculations and design principles,Creating buildings that are both beautiful and stable,Review designs from different perspectives,Design innovative structures for challenging environments,Construction and architecture,Structural engineering and architectural design courses,Structural Engineer
179,Game Development and Programming,Building video games and studying player metrics,Iteratively develop and test game mechanics,Game studio with player testing facilities,Game programming and user experience design,Creating engaging gameplay experiences,Playtest with different users and iterate,Develop innovative video games,Gaming and technology,Game development courses and programming practice,Game Developer
180,Biotechnology and Genetics,Gene editing experiments and biotech research,Design precise experiments with control groups,Biotechnology laboratory with advanced equipment,Genetic analysis and biotechnology applications,Developing new biotechnology solutions,Maintain detailed documentation and consult colleagues,Lead biotechnology research and development,Healthcare and agriculture,Biotechnology courses and genetic research,Biotechnologist
181,Digital Marketing and Analytics,Marketing campaign design and performance analysis,Test different approaches and analyze data,Marketing agency with data-driven approach,Campaign strategy and analytics,Creating marketing strategies that deliver results,Take data-informed breaks and pivot strategies,Lead digital marketing for major brands,Advertising and e-commerce,Marketing analytics and campaign management courses,Digital Marketing Analyst
182,Environmental Law and Policy,Environmental case analysis and policy research,Apply legal frameworks to environmental challenges,Environmental law firm or advocacy organization,Legal analysis and policy development,Creating environmental protections through law,Take nature breaks and maintain perspective,Shape environmental policy at national level,Law and environmental organizations,Environmental law courses and policy studies,Environmental Lawyer
183,Industrial Design and Human Factors,Product prototyping and ergonomic testing,Consider both form and function in design,Design studio with prototyping capabilities,Design thinking and ergonomic analysis,Creating products that people love to use,Build quick prototypes and test with users,Design innovative consumer products,Manufacturing and technology,Industrial design courses and human factors research,Human-Centered Designer
184,Computational Biology and Genomics,Genome analysis and biological modeling,Apply computational methods to biological data,Research institution with bioinformatics focus,Data analysis and biological systems knowledge,Discovering patterns in genomic data,Break complex analyses into smaller steps,Lead genomic research projects,Biotechnology and healthcare,Computational biology courses and genomic datasets,Computational Biologist
185,Linguistics and Natural Language Processing,Language pattern analysis and algorithm development,Break down language structures and test models,Technology company with linguistics team,Linguistic analysis and algorithm development,Creating systems that understand human language,Compare model outputs with human language use,Develop advanced language technologies,Technology and communication,Linguistics courses and NLP research,Computational Linguist
186,Sociology and Urban Studies,Community research and urban demographic analysis,Gather diverse perspectives and analyze social patterns,Research organization with community focus,Social research and urban analysis,Understanding how communities function and evolve,Take breaks to engage with different communities,Lead urban community development initiatives,Government and non-profit,Sociology courses and urban field research,Urban Sociologist
187,Renewable Energy Economics,Energy market analysis and sustainability modeling,Apply economic principles to renewable energy,Energy consultancy with sustainability focus,Economic analysis and energy systems knowledge,Developing financially viable green energy solutions,Consider multiple stakeholder perspectives,Shape renewable energy policy and markets,Energy sector and consulting,Energy economics and renewable systems courses,Renewable Energy Economist
188,Embedded Systems and IoT,Building smart devices and sensor networks,Break down system requirements and test components,Technology company with IoT focus,Microcontroller programming and sensor integration,Creating devices that interact with the environment,Test one component at a time with systematic approach,Develop innovative IoT solutions,Technology and manufacturing,Embedded systems courses and IoT prototyping,IoT Systems Engineer
189,Nutrition and Food Technology,Food product development and nutritional analysis,Balance flavor profiles and health benefits,Food technology company with nutrition focus,Food science and nutritional analysis,Developing food products that are healthy and appealing,Test with different audiences and iterate,Lead food innovation at major companies,Food industry and health,Nutrition courses and food science practice,Food Technologist
190,Cybersecurity and Risk Management,Security assessment and risk analysis,Identify vulnerabilities and prioritize mitigations,Security consulting firm with enterprise clients,Risk analysis and security protocol development,Protecting organizations from digital threats,Maintain systematic approach and document thoroughly,Lead cybersecurity strategy for major organizations,Technology and finance,Security certifications and risk management courses,Cybersecurity Risk Manager
191,Virtual Reality and Immersive Technology,VR environment design and user testing,Create spatial experiences and test with users,Technology company with VR development focus,3D modeling and human-computer interaction,Creating immersive virtual experiences,Test with diverse users and gather feedback,Pioneer new applications of VR technology,Gaming and education,VR development courses and user experience research,VR Experience Developer
192,Aerospace Engineering and Propulsion,Rocket propulsion design and aerodynamic modeling,Apply physics principles to aerospace challenges,Aerospace company with R&D division,Propulsion systems and aerodynamic analysis,Developing more efficient aerospace systems,Break complex problems into physical components,Lead aerospace propulsion innovation,Aerospace and defense,Aerospace engineering and propulsion studies,Propulsion Engineer
193,Content Strategy and Digital Media,Content planning and audience analysis,Map content to user journeys and test engagement,Digital media company with analytics focus,Content development and audience engagement,Creating content strategies that resonate with audiences,Take breaks to consume different content formats,Lead content strategy for major brands,Media and technology,Content strategy courses and digital analytics,Content Strategist
194,Human-Computer Interaction and Accessibility,Interface design and accessibility testing,Design for diverse users and test usability,Technology company with user research team,User research and interface design,Creating technology that works for everyone,Test with diverse user groups and iterate,Lead accessibility initiatives at major tech companies,Technology and healthcare,HCI courses and accessibility standards,Accessibility Specialist
195,Marine Biology and Conservation,Ocean ecosystem study and conservation planning,Collect field data and analyze ecosystem impacts,Marine research organization with conservation focus,Marine ecosystem analysis and conservation planning,Protecting marine biodiversity,Spend time in nature to maintain perspective,Lead major marine conservation initiatives,Environmental organizations and research,Marine biology courses and field research,Marine Conservationist
196,Data Visualization and Communication,Data dashboard design and presentation development,Transform complex data into clear visuals,Analytics company with visualization focus,Data analysis and visual design,Making complex information understandable,Get feedback from non-technical users,Create data visualization tools and standards,Technology and consulting,Data visualization techniques and communication studies,Data Visualization Specialist
197,Sustainable Agriculture and Food Systems,Organic farming and food system analysis,Apply ecological principles to food production,Sustainable farm with research component,Agricultural techniques and systems thinking,Developing more sustainable food systems,Connect with nature and observe natural patterns,Lead sustainable agriculture initiatives,Agriculture and environmental organizations,Sustainable agriculture courses and systems thinking,Sustainable Food Systems Analyst
198,Music Technology and Production,Sound engineering and music composition,Layer audio components and test different arrangements,Music studio with production facilities,Audio engineering and musical composition,Creating engaging and high-quality music,Take listening breaks and seek fresh perspectives,Produce music for entertainment industry,Media and entertainment,Music production courses and audio engineering practice,Music Producer
