80,IT, Cloud, Infra,Cloud deployment, Kubernetes,Split by services and simulate scale,Remote DevOps setups,CI/CD, logs, infra setup,Auto-scaling backend,Play calming music and retry,Manage cloud infra for SaaS,Cloud, DevOps, Infra,AWS/GCP docs,Cloud Infrastructure Engineer
81,Computer Science, Systems Programming, OS Internals,Writing OS modules, reverse engineering,Trace processes and debug with tools,Quiet deep-focus setups,C, Linux, Memory mgmt,Debugging system-level bugs,Step back and map execution,Build operating systems kernels,Systems, Embedded, Security,System Programming courses,System Software Engineer
82,Marketing, Psychology, Consumer Behavior,Ad design, analyzing consumer responses,Understand customer psychology and reframe,Collaborative and data-driven setups,Ad strategy, market metrics,Running brand recall tests,Pause and research competitor data,Work in brand psychology,Marketing, Retail, Advertising,Case studies,Consumer Psychologist
83,Physics, Aerospace, Math,Simulations, rocket launches,Calculate drag, force, thrust on models,Aerospace labs and wind tunnels,Propulsion, simulations, 3D modeling,Testing lift dynamics,Pause and rethink assumptions,Work with ISRO or NASA,SpaceTech, Aerospace, Research,Aerospace toolkits,Aerospace Engineer
84,Business, Leadership, Strategy,Team building games, startup bootcamps,Break into KPIs and goals,Startup and lean teams,Planning, team mgmt, pitching,Goal-oriented task planning,Use SWOT or OKRs again,Launch multiple companies,Startups, Incubators, VC,Startup case studies,Entrepreneur
85,Computer Science, NLP, Linguistics,Training chatbots, tokenization,Clean text, lemmatize and train intent models,Language-model driven teams,Embeddings, parsing, intents,Intent classification retries,Step away then review logs,Build conversational AI,NLP, Chatbots, Tech,NLP projects,NLP Engineer
86,Math, Statistics, Probability,Solving statistical puzzles,Apply probability in real-world simulations,Academic or research labs,Distributions, sampling, random vars,Deriving variance outcomes,Retry simulations,Research statistical modeling,Analytics, Research, Finance,Statistical books,Statistician
87,Law, Public Policy, Ethics,Case simulations, reviewing judgments,Break issues with legal frameworks,Debate-friendly teams,Case law, precedent, appeal,Analyzing arguments,Take a break or review statutes,Work in constitution & policy,Law, Politics, Human Rights,Law papers,Legal Policy Analyst
88,Computer Science, DevOps, CI/CD,Pipeline creation, Docker setups,Automate delivery and monitor performance,Automation-centric teams,Build, test, deploy scripts,Automation and rollout issues,Restart flow and monitor,Create DevOps platforms,Cloud, SaaS, Automation,Jenkins, Terraform practice,CI/CD Engineer
89,History, Political Science, Journalism,Writing editorials, tracking global events,Timeline-based pattern recognition,Newsrooms and editorial teams,Historical data, fact-based writing,Writing policy or news columns,Pause and rewrite,Work with investigative bureaus,Media, Journalism, Policy,News articles,Political Journalist
90,Commerce, Finance, Blockchain,Crypto news, NFT tracking,Trace transactions, verify consensus,Decentralized org setups,Blockchain, cryptography,Creating smart contracts,Debug or test on testnet,Work in crypto exchanges,Fintech, Blockchain, Crypto,Blockchain MOOCs,Blockchain Developer
91,Psychology, Neuroscience, Bioinformatics,Researching cognition, mind-machine interface,Understand neuron patterns and simulate,Neuro-labs with computation tools,Bio-signals, neural networks,Neural mapping experiments,Pause to process findings,Build brain-machine interfaces,NeuroTech, AI, Bioinformatics,BCI research,Bioinformatics Engineer
92,Art, Fashion, Culture,Fashion sketching, watching trends,Understand mood, pattern, colors,Collaborative design studios,Design boards, textiles,Designing season collection,Sketch again from user POV,Work in luxury brands,Fashion, Retail, Design,Fashion magazines,Fashion Designer
93,Math, Computer Science, Cryptography,Solve encryptions, cryptographic puzzles,Use key exchange and modular arithmetic,Cryptography labs,Secure hashing, RSA, AES,Creating secure protocols,Check logic or key reuse,Design cryptographic protocols,Crypto, Cybersecurity, Blockchain,Crypto lectures,Cryptographer
94,Computer Science, Testing, QA,Writing test cases, testing APIs,Write test plans and assert outcomes,QA-specific agile teams,Selenium, unit testing,Automated regression testing,Recheck logs, test again,Lead QA process in company,Tech, SaaS, Enterprise,Testing courses,QA Engineer
95,Environmental Science, Chemistry, Ecology,Soil sampling, waste management,Use chemistry to understand toxins,Field labs and remote sensing teams,Eco indices, pollution metrics,Field report analysis,Take fresh air and reset,Research sustainable models,ClimateTech, NGOs, Research,Sustainability courses,Environmental Scientist
96,Design, Web Dev, UI Design,Figma mockups, CSS tricks,Refactor and test responsiveness,Frontend design teams,Colors, spacing, flex/grid,Web animations and UIs,Test across devices,Build creative landing pages,Tech, E-commerce, Design,Figma practice,Web Designer
97,Biology, HealthTech, Diagnostics,Reading reports, case-based learning,Trace symptoms with biology and tech,Health diagnostics firms,Biomarkers, testing protocols,Analyzing disease progression,Talk to senior or re-read case,Work in AI-health products,Healthcare, Biotech, Tech,Case-based learning,Bioinformatics Specialist
98,English, Psychology, Communication,Public speaking, debating,Break context, understand tone,Empathetic team discussions,Listening, communication, empathy,Helping in therapy sessions,Take space then revisit,Work as therapist or mediator,HR, Therapy, Media,Empathy drills,Communications Specialist
99,Computer Science, Cloud, Kubernetes,Deploying containers, managing nodes,Divide workload and auto-scale,Cloud-native teams,K8s, Helm, scaling,Manage cloud clusters,Reconfigure pods and redeploy,Work in hybrid infra teams,Cloud, DevOps, SaaS,Kubernetes docs,Kubernetes Engineer
100,Math, Game Theory, AI,Analyzing player strategies, board games,Apply Nash equilibrium, simulate games,Think-tank style environments,Payoffs, reward systems,Modeling decision games,Rest or switch game models,Model economic or AI games,AI, Finance, Academia,Game theory MOOCs,Game Theory Specialist
101,Physics and Mathematics,Building mechanical devices and playing chess,Break problems into smaller components and apply known principles,Structured environment with clear objectives,Analytical thinking and mathematical modeling,Designing and optimizing systems,Take a systematic approach and focus on one aspect at a time,Lead engineering teams on innovative projects,Aerospace and renewable energy,Learn by doing hands-on projects and simulations,Mechanical Engineer
102,Biology and Chemistry,Gardening and reading scientific journals,Research extensively and test hypotheses methodically,Laboratory setting with collaborative research teams,Scientific experimentation and detailed observation,Conducting experiments and analyzing results,Make a detailed plan and follow scientific methods,Contribute to medical advancements through research,Healthcare and pharmaceutical,Reading scientific papers and conducting experiments,Biomedical Researcher
103,Literature and Psychology,Creative writing and analyzing character motivations in films,Approach from multiple perspectives and use empathy,Flexible work environment with creative freedom,Storytelling and character development,Creating narratives that resonate with audiences,Journal thoughts and take mindful breaks,Publish novels and possibly teach creative writing,Publishing and entertainment,Reading widely and writing daily,Author/Novelist
104,Economics and Political Science,Debating global issues and analyzing market trends,Look at historical patterns and consider stakeholder interests,Policy-oriented environment with intellectual discussions,Data analysis and policy formulation,Developing strategies that balance different interests,Prioritize tasks and discuss with mentors,Work in international economic policy,Government and international organizations,Reading policy papers and discussing with experts,Economic Policy Advisor
105,Computer Science and Design,3D modeling and playing strategy video games,Visualize the end result and work backwards,Creative tech studio with modern equipment,3D rendering and creative problem solving,Creating immersive virtual environments,Break tasks into achievable milestones,Work on cutting-edge VR/AR applications,Gaming and virtual reality,Online tutorials and participating in game jams,3D Environment Artist
106,Sociology and Statistics,Volunteering and analyzing social datasets,Gather diverse perspectives and analyze quantitative data,Community-focused organization with research capabilities,Data collection and social analysis,Identifying patterns in community behavior,Take breaks to connect with people affected by the issue,Lead social impact assessments for major projects,Non-profit and social research,Field research and community workshops,Social Impact Researcher
107,Electrical Engineering and Robotics,Building small robots and attending tech meetups,Test different approaches and iterate rapidly,Innovation lab with cutting-edge equipment,Circuit design and programming microcontrollers,Seeing robots successfully perform automated tasks,Focus on solving one technical issue at a time,Develop robotics for healthcare applications,Robotics and healthcare technology,Prototyping and testing different components,Robotics Engineer
108,Marketing and Psychology,Social media trend analysis and consumer behavior studies,Consider different audience segments and test messaging,Dynamic marketing agency with diverse clients,Consumer insight analysis and campaign planning,Creating campaigns that drive measurable results,Brainstorm with colleagues and use analytics for guidance,Lead marketing strategy for global brands,Consumer goods and digital marketing,Marketing case studies and A/B testing campaigns,Marketing Strategist
109,Environmental Science and Chemistry,Nature photography and environmental activism,Collect field data and analyze environmental impacts,Field and laboratory work with conservation focus,Environmental sampling and data interpretation,Contributing to conservation efforts,Spend time in nature to refocus and prioritize,Lead environmental impact assessments,Environmental consulting and conservation,Field studies and environmental monitoring,Environmental Scientist
110,International Relations and Languages,Cultural exchange programs and language learning,Consider geopolitical contexts and multiple viewpoints,International organization with diverse teams,Cross-cultural communication and diplomacy,Facilitating understanding between different cultures,Practice mindfulness and seek diverse perspectives,Work in diplomatic roles or international organizations,Diplomacy and international development,Language immersion and international internships,Diplomat
111,Finance and Mathematics,Investment simulations and financial analysis,Quantitative analysis and risk assessment,Fast-paced financial firm with analytical focus,Financial modeling and investment analysis,Identifying profitable investment opportunities,Create structured analyses and take calculated steps,Manage investment portfolios for major institutions,Investment banking and asset management,Financial modeling and investment simulations,Investment Analyst
112,Architecture and Art History,Urban sketching and visiting architectural landmarks,Sketch multiple concepts before detailed development,Design studio with collaborative atmosphere,Spatial thinking and aesthetic sensibility,Creating designs that balance form and function,Take inspiration walks and study architectural precedents,Design sustainable buildings with cultural significance,Architecture and urban planning,Design projects and architectural theory,Architect
113,Computer Science and Cybersecurity,Participating in capture the flag competitions and studying network protocols,Methodically test for vulnerabilities and think like an attacker,Security operations center with cutting-edge tools,Network analysis and security protocol implementation,Finding and fixing security vulnerabilities,Step away briefly then approach with fresh perspective,Lead cybersecurity for major organizations,Information security and financial technology,Security certifications and pentesting practice,Cybersecurity Analyst
114,Music Theory and Audio Engineering,Composing music and building audio setups,Listen carefully and apply technical and creative solutions,Music studio with professional equipment,Sound design and musical composition,Creating emotion through sound,Take listening breaks and refer to reference tracks,Compose for film and interactive media,Entertainment and gaming,Music production projects and sound design practice,Music Composer
115,Nutrition and Exercise Science,Fitness training and meal planning,Research evidence-based approaches and personalize solutions,Wellness center with supportive community,Health assessment and program design,Helping others achieve their health goals,Practice self-care and maintain personal wellness,Run a holistic wellness practice,Health and fitness,Certification programs and client case studies,Wellness Coach
116,History and Archaeology,Historical reenactments and artifact analysis,Research primary sources and compare with physical evidence,Field expeditions and research institutions,Historical research and archaeological techniques,Uncovering new information about past civilizations,Organize research methodically and collaborate with experts,Lead archaeological expeditions,Museums and cultural heritage,Archaeological field schools and historical research,Archaeologist
117,Graphic Design and Marketing,Brand identity development and advertising analysis,Sketch multiple concepts and iterate based on feedback,Creative agency with collaborative teams,Visual communication and brand strategy,Creating designs that communicate effectively,Take visual inspiration breaks and get peer feedback,Creative director for major brands,Advertising and branding,Design portfolio development and industry workshops,Brand Designer
118,Journalism and Political Science,News writing and political analysis,Verify facts from multiple sources and consider context,Fast-paced newsroom with investigative focus,Research and clear communication,Breaking important stories with accuracy,Maintain strict deadlines and verification processes,Report on major international events,News media and political analysis,Journalistic training and political reporting,Political Journalist
119,Human Resources and Psychology,Conflict resolution and employee engagement initiatives,Consider organizational and individual needs,People-focused corporate environment,Interpersonal communication and organizational development,Improving workplace culture and employee satisfaction,Practice active listening and emotional intelligence,Lead HR strategy for global organizations,Corporate and consulting,HR certification and organizational psychology,HR Director
120,Software Engineering and Mathematics,Developing algorithms and contributing to open source,Break down complex problems into logical components,Tech company with strong engineering culture,Algorithmic thinking and software architecture,Building efficient systems that scale,Take short coding breaks and use rubber duck debugging,Lead engineering at tech companies,Software and financial technology,Coding challenges and system design practice,Software Architect
121,Game Design and Psychology,Creating game prototypes and studying player behavior,Balance creative vision with player experience,Game studio with iterative development cycle,Game mechanics design and player psychology,Creating engaging player experiences,Playtest with different audiences and iterate,Design innovative games with cultural impact,Gaming and interactive entertainment,Game jams and player testing sessions,Game Designer
122,Data Science and Business,Kaggle competitions and business case analysis,Find patterns in data and translate to business insights,Data-driven company with business focus,Data analysis and business strategy,Discovering insights that drive business decisions,Break complex analyses into manageable parts,Lead data strategy for major corporations,Technology and consulting,Business analytics projects and data competitions,Business Intelligence Analyst
123,Mechanical Engineering and Sustainability,Designing eco-friendly devices and renewable energy projects,Consider environmental impact and engineering constraints,Green technology company with research focus,Sustainable design and mechanical systems,Creating solutions that are both effective and sustainable,Focus on one component at a time and integrate holistically,Develop renewable energy technologies,Clean tech and engineering,Sustainability workshops and engineering projects,Sustainable Design Engineer
124,Film Studies and Writing,Short film production and screenplay writing,Storyboard ideas and revise based on feedback,Production company with creative freedom,Visual storytelling and script development,Creating stories that connect emotionally with audiences,Take inspiration from other media and collaborate,Direct and write feature films,Film and television,Filmmaking projects and screenplay competitions,Filmmaker
125,Neuroscience and Computer Science,Brain-computer interface experiments and cognitive research,Study biological systems and apply to computational models,Research lab with interdisciplinary approach,Experimental design and data analysis,Making discoveries at the intersection of mind and machine,Take regular breaks and maintain clear lab notes,Lead research in brain-computer interfaces,Neurotechnology and research,Neuroscience research and programming practice,Neurotech Researcher
126,Education and Psychology,Tutoring and learning theory research,Apply different teaching approaches based on student needs,Student-centered learning environment,Curriculum development and student engagement,Seeing students grasp difficult concepts,Practice patience and celebrate small victories,Develop innovative educational approaches,Education and educational technology,Teaching practice and educational psychology studies,Educational Innovator
127,Chemical Engineering and Environmental Science,Laboratory experiments and sustainable process design,Balance efficiency with environmental considerations,Sustainable industry with research facilities,Chemical process design and environmental analysis,Developing processes that minimize environmental impact,Break down complex problems into chemical reactions,Lead sustainable chemical manufacturing,Chemical industry and environmental consulting,Process simulation and green chemistry research,Green Process Engineer
128,Digital Marketing and Data Analysis,Social media campaigns and conversion rate analysis,Test different approaches and analyze performance data,Results-oriented marketing agency,Performance analysis and campaign optimization,Driving measurable business growth through digital channels,Use data to guide decisions and take creative breaks,Lead digital strategy for major brands,E-commerce and digital marketing,Marketing analytics projects and campaign management,Digital Growth Strategist
129,Public Health and Statistics,Community health surveys and epidemiological studies,Analyze population data and consider social determinants,Health agency with research capabilities,Data analysis and public health program design,Improving health outcomes for communities,Maintain work-life balance and clear communication,Lead public health initiatives,Government health agencies and non-profits,Epidemiology studies and community health assessment,Public Health Epidemiologist
130,Interior Design and Psychology,Space planning and environmental psychology research,Consider functionality and emotional impact,Design studio with residential and commercial projects,Spatial design and client communication,Creating spaces that enhance wellbeing,Get fresh perspectives and create mood boards,Own a design firm specializing in wellness-focused spaces,Architecture and residential design,Design portfolio development and psychology studies,Wellness Interior Designer
131,Chemical Engineering and Material Science,Material testing and polymer research,Analyze properties and conduct controlled experiments,Research lab with advanced materials testing equipment,Chemical analysis and material property testing,Developing new materials with specific properties,Focus on methodology and document failures,Lead materials research for advanced applications,Manufacturing and aerospace,Materials science journals and lab experiments,Materials Scientist
132,Computer Science and Natural Language Processing,Building language models and studying linguistics,Break down language problems into tokens and semantics,AI research team with computational linguistics focus,Machine learning and linguistic analysis,Creating more natural human-computer interactions,Switch between theory and implementation,Develop next-generation language technologies,Tech and education,NLP courses and linguistic datasets,NLP Engineer
133,Marine Biology and Oceanography,Coral reef documentation and ocean conservation projects,Gather field data and analyze ecological relationships,Research vessels and coastal laboratories,Marine ecosystem analysis and species identification,Discovering patterns in marine biodiversity,Maintain detailed logs and discuss with colleagues,Lead ocean conservation research,Marine research and conservation,Field expeditions and marine biology journals,Marine Biologist
134,Sports Science and Nutrition,Athletic training and nutrition experimentation,Analyze performance data and adjust training protocols,Sports performance facility with research capabilities,Performance analysis and nutritional assessment,Helping athletes achieve peak performance,Use data to refine approaches and consult experts,Develop training programs for elite athletes,Sports and healthcare,Sports medicine research and practical coaching,Sports Performance Coach
135,Urban Planning and Sociology,Community mapping and urban development analysis,Consider multiple stakeholders and simulate outcomes,City planning department with community focus,Spatial planning and social impact assessment,Creating more livable and equitable urban spaces,Gather community feedback and revise plans,Lead major urban development projects,Government and architecture,Urban studies and community engagement projects,Urban Planner
136,Photography and Visual Storytelling,Street photography and photo essay creation,Study composition and emotional impact,Creative studio with field assignments,Visual composition and narrative development,Capturing moments that tell powerful stories,Take walks to find new perspectives,Publish documentary photography books,Media and journalism,Photography workshops and visual storytelling practice,Documentary Photographer
137,Quantum Computing and Physics,Quantum algorithm development and physics research,Apply quantum principles to computational problems,Research institution with quantum computing facilities,Quantum theory and computational modeling,Solving problems using quantum approaches,Break down complex theories into testable components,Pioneer quantum computing applications,Technology and research,Quantum physics courses and algorithm design,Quantum Computing Researcher
138,Renewable Energy and Electrical Engineering,Solar system design and energy efficiency research,Calculate energy requirements and optimize solutions,Renewable energy company with R&D division,Electrical systems design and energy analysis,Developing efficient renewable energy solutions,Focus on one component before integration,Lead renewable energy technology development,Clean technology and engineering,Energy systems modeling and prototyping,Renewable Energy Engineer
139,Anthropology and Linguistics,Cultural documentation and language preservation,Compare cultural patterns and document languages,Field research and academic institutions,Cultural analysis and linguistic documentation,Preserving endangered languages and cultures,Immerse in different perspectives,Lead cross-cultural research projects,Academia and cultural organizations,Ethnographic research and linguistic fieldwork,Cultural Anthropologist
140,Food Science and Culinary Arts,Recipe development and food chemistry experiments,Apply scientific principles to culinary techniques,Research kitchen with lab facilities,Flavor chemistry and culinary technique,Creating new food products with specific qualities,Test multiple variations and document results,Develop innovative food products,Food industry and hospitality,Culinary training and food science research,Food Product Developer
141,Aerospace Engineering and Astronomy,Spacecraft modeling and astronomical observation,Apply physics principles to aerospace challenges,Aerospace research facility with simulation equipment,Propulsion systems and orbital mechanics,Designing systems that function in space,Break problems into physical components,Lead spacecraft design teams,Space technology and aviation,Aerospace engineering projects and astronomy research,Aerospace Systems Engineer
142,Artificial Intelligence and Ethics,AI ethics research and algorithm development,Consider multiple ethical frameworks and technical constraints,Research institution with interdisciplinary teams,Ethical analysis and AI system design,Developing AI systems that align with human values,Step back to consider broader implications,Shape the ethical development of AI,Technology and philosophy,AI ethics literature and technical implementation,AI Ethics Researcher
