199,Behavioral Economics and Psychology,Behavioral experiments and economic modeling,Apply psychological insights to economic behavior,Research institution with behavioral focus,Experimental design and economic analysis,Understanding how psychology affects economic decisions,Take breaks to reflect on personal biases,Develop behavioral economics applications,Finance and public policy,Behavioral economics research and psychology studies,Behavioral Economist
200,Mechatronics and Automation,Robotic system design and automation testing,Integrate mechanical and electronic components,Engineering firm with automation focus,Mechanical design and electronic control systems,Creating systems that automate complex tasks,Test individual components before integration,Develop advanced automation solutions,Manufacturing and technology,Mechatronics courses and automation projects,Mechatronics Engineer
201,Math, Finance, Investments,Stock watching, portfolio balancing,Analyze returns vs risk,Investment banking desks,Excel, CAGR, IRR,Portfolio modeling,Pause and rebalance,Work in equity firms,Finance, Stock Market, Investments,Market insights,Investment Analyst
202,Commerce, Taxation, Auditing,Tax planning, GST filing,Match tax laws with expenses,Accounting teams and CA firms,GST, IT returns,Form-26AS audits,Refer to Income Tax portal,Join tax advisory firms,Finance, Taxation, Compliance,IT rules,Tax Consultant
203,Economics, Statistics, Data Analysis,Analyzing market indexes, use R,Solve regression with time series,Banking analytics teams,R, Excel, SPSS,Statistical market patterns,Check data consistency,Build market models for firms,Finance, Research, Consulting,SPSS practice,Quantitative Analyst
204,Commerce, Investment Banking, Economics,Creating pitch books, reviewing IPOs,Divide mergers and deal structure,Fast-paced deal rooms,DCF, M&A, LBO,Deal financial modeling,Take 15-min recharge and retry,Structure M&A deals,Banking, Consulting, IPOs,IB prep courses,Investment Banker
205,Business, Finance, Strategy,Tracking KPIs, profitability metrics,Link performance to strategy,Strategic finance teams,KPIs, EBITDA, valuation,Strategic reporting,Pause and realign KPIs,Support CFO functions,Finance, Strategy, Business,Corporate finance guides,Financial Strategist
206,Math, Finance, Derivatives,Options trading, analyzing volatility,Use greeks to hedge risk,Trading floors and quant firms,Options, VIX, Black-Scholes,Options valuation testing,Re-check risk metrics,Hedge fund or quant desk,Trading, Quant, Hedge Funds,Options books,Derivatives Trader
207,Finance, Compliance, Regulations,Reading SEBI updates, compliance logs,Apply regulatory mapping to firm,Structured compliance teams,SEBI, AML, KYC,Regulatory breach tests,Review laws and retry,Ensure legal adherence,Finance, Legal, Risk,KYC training,Compliance Officer
208,Economics, Banking, Policy,Following RBI circulars, analyzing rates,Map repo rates to inflation,Banking think-tanks,Repo, CRR, inflation,RBI policy analysis,Refer monetary policy reports,Assist banking decisions,Finance, Govt, Central Banks,RBI lectures,Monetary Policy Analyst
209,Math, Finance, Quant,Modeling with linear algebra,Write risk models, backtest,Quant firms or Algo desks,Python, NumPy, Pandas,Backtesting strategies,Run on data again,Build models for banks,Quant, Algo, FinTech,Quant courses,Quant Developer
210,Finance, Blockchain, Crypto,Trading coins, checking DeFi trends,Deconstruct smart contracts,Fintech DeFi teams,Solidity, MetaMask, Tokenomics,Create smart contract tokens,Test on testnet,Launch DeFi tools,FinTech, Crypto, Blockchain,Solidity & DeFi,DeFi Analyst
211,Commerce, Insurance, Risk,Claim assessment, risk calculation,Use probability and loss metrics,Insurance companies,Risk scoring, Underwriting,Calculating insurance premiums,Recheck policy terms,Work with global insurers,Insurance, Actuary, Risk,IRDA books,Insurance Analyst
212,Finance, Excel Modeling, Valuation,Building Excel dashboards,Make pro forma projections,PE or VC modeling teams,DCF, 3-statement model,Forecasting earnings,Refresh Excel structure,Pitch startups to investors,VC, PE, Finance,Startup finance courses,Financial Modeler
213,Finance, Corporate Law, Ethics,Managing financial documentation,Understand legal finance gaps,Audit/legal desk setups,Audit trails, ROC, MCA forms,Document trail testing,Ask legal team and retry,Work in IPO/ROC filings,Law, Finance, Corporate,MCA/ROC courses,Corporate Legal Analyst
214,Finance, Treasury, Liquidity,Cash flow management, treasury reports,Use rolling forecasts and buffers,Treasury teams in MNCs,Cash flow, liquidity, FX hedge,Liquidity optimization,Run buffer simulations,Manage daily liquidity,Finance, Forex, MNC,Treasury tools,Treasury Analyst
215,Economics, Analytics, Market Trends,Analyzing bond markets, global indexes,Correlate news to market shifts,Economic research desks,Index trends, oil price impact,Analyzing macro trends,Switch index or region,Track global finance trends,Economics, Finance, Research,Market trend reports,Financial Market Analyst
216,Math, Actuarial Science, Statistics,Life expectancy analysis, pension math,Model life tables with mortality rates,Insurance actuarial labs,Life tables, annuity models,Actuarial test cases,Pause and recalculate premium,Join insurance actuarial teams,Insurance, Pensions, Risk,SOA/actuary content,Actuary
217,Finance, Audit, Ethics,Checking compliance, ethical breaches,Match audit gaps with actions,Internal audit teams,Audit log, finance gap check,Document irregularities,Refer ethics code,Internal checks for MNCs,Audit, Compliance, Finance,Audit notes,Internal Auditor
218,Finance, FinTech, App Development,Testing loan flow in finance app,Map UI to backend accounting,Startup or product teams,Flutter, Firebase, Stripe,Finance UI testing,Log errors and retry,Build finance-focused apps,FinTech, SaaS, Startups,Flutter finance projects,FinTech App Developer
219,Finance, AI, Fraud Detection,Detecting fraud patterns in logs,Train anomaly models using logs,AML & AI teams,Isolation forest, transaction logs,Building fraud prediction tools,Check threshold accuracy,Secure online transactions,AI, FinTech, Cybersecurity,Fraud detection papers,Financial Fraud Analyst
220,Commerce, Banking, Retail Finance,Customer onboarding, loan processing,Use CRM + KYC rules to validate,Banking branches,CRM, Loan rules, eligibility,Validating income vs credit,Check application pipeline,Support bank onboarding,Banking, Retail, CRM,Banking ops tutorials,Personal Banker
,221,Finance, ESG, Sustainability,Analyzing ESG reports, sustainable projects,Map company activities to ESG goals,Green finance teams,ESG scores, carbon credit,Sustainability indexing,Refer ESG handbook,Work in green finance,Finance, Sustainability, ESG,ESG case studies,ESG Investment Analyst
222,Economics, Finance, Data Analysis,Studying GDP vs inflation effects,Forecast macroeconomic indicators,Policy modeling groups,Regression, CPI, interest rate,Modeling inflation forecasts,Adjust coefficients,Work in financial forecasting,Research, Economics, Finance,Macroeconomics models,Financial Economist
223,Finance, Risk, Compliance,Reviewing AML alerts, KYC patterns,Identify flagged transactions,Bank risk and compliance desks,KYC, AML, risk triggers,Monitor for false positives,Escalate to compliance team,Risk, FinTech, Banking,AML guidelines,Risk Compliance Analyst
224,Commerce, Financial Accounting, Audits,Ledger entry and closing accounts,Match cash flow and balances,Audit teams and corp finance,Tally, Balance Sheets, P&L,Year-end reconciliations,Verify entries twice,Support financial audits,Corporate, Finance, Audit,Accounting books,Financial Auditor
225,Finance, AI, Forecasting,Train models on stock prediction,Build trend-based prediction models,Quant + ML firms,LSTM, ARIMA, time series,Hyperparameter tuning,Test other models,Create stock forecasting engines,AI, FinTech, Trading,ML forecasting guides,Financial AI Engineer
226,Commerce, Finance, Banking Laws,Reading RBI & SEBI guidelines,Understand finance regulations,Legal-finance team setups,Banking Law, SEBI Act,Compliance scenario cases,Recheck section mapping,Manage regulatory affairs,Law, Finance, Banking,Banking legal texts,Finance Compliance Officer
227,Math, Finance, Credit Risk,Scoring credit applications,Use scoring models to decide,Credit risk analysis team,Credit score, PD, LGD,Stress testing credit portfolios,Change parameters,Build better scoring models,Banking, FinTech, Risk,Credit risk casebooks,Credit Risk Analyst
228,Finance, Treasury, Forex,Managing currency exposure,Track exchange rate fluctuations,Treasury/forex desks,FX swaps, currency hedging,Hedging strategy errors,Run new forward contracts,Work in global currency markets,Banking, Forex, Treasury,FX tutorials,Forex Analyst
229,Economics, Finance, Microfinance,Meeting rural borrowers, checking repayment,Adapt lending models to underserved,Rural banking and NGOs,SHG, microloans, interest,Loan utilization analysis,Field validation,Empower rural economies,Finance, Social, Development,Microfinance reports,Microfinance Officer
230,Finance, Quant, Python,Modeling pricing strategy in Python,Backtest with historical financial data,Quantitative trading groups,NumPy, SciPy, pandas,Time series backtests,Tune model thresholds,Work in algorithmic trading,Quant, Tech, Trading,Python for Finance,Quantitative Developer
231,Finance, Insurance, Claims,Verifying insurance reports,Analyzing claim eligibility,Insurance underwriting teams,Claim processing, fraud alerts,Claim authenticity testing,Send for re-verification,Support claims team,Insurance, Risk, Operations,Insurance domain training,Claims Analyst
232,Finance, Portfolio Management,Creating mock portfolios,Choose allocation based on goals,Wealth management firms,Portfolio allocation, SIP, NAV,Checking sector weightage,Switch assets,Support client investments,Wealth, Investment, Consulting,Portfolio guides,Portfolio Manager
233,Finance, Valuation, Equity,Valuing startups, creating pitchbooks,Use comps and DCF for equity,VC/PE firms and advisory,Dilution, Pre/Post money,Startup valuation errors,Check cap table again,Support VC evaluation,Finance, VC, Startups,Valuation frameworks,Equity Research Analyst
234,Finance, FinTech, APIs,Integrating Razorpay/Stripe in apps,Connect backend to payment gateways,FinTech startups and banks,UPI, APIs, PG logs,Transaction debugging,Use test environments,Build API-ready products,FinTech, SaaS, Payments,FinTech tutorials,FinTech Integrations Engineer
235,Finance, Investment Banking, M&A,Working on buy-side/sell-side decks,Analyze synergy in acquisition deals,Investment banking floors,Valuation, synergy, due diligence,M&A deal sheet review,Change assumptions,Close corporate M&A deals,Banking, M&A, Consulting,M&A tutorials,M&A Analyst
236,Finance, Corporate Strategy,Analyzing revenue forecasts,Match business plans with performance,Corporate strategy units,Business model, KPIs,Forecasting outcome mismatches,Adjust revenue drivers,Support CEO/CFO desk,Corporate, Strategy, Finance,Corporate playbooks,Strategic Finance Analyst
237,Finance, FinOps, SaaS,Tracking cloud spend and billing,Identify cost spikes in infra,Finance + DevOps teams,Cloud cost, FinOps tools,AWS billing and savings plans,Flag overspend alerts,Optimize SaaS infra spend,Cloud, SaaS, Finance,FinOps books,FinOps Analyst
238,Finance, Ethics, Regulations,Assessing fraud risks, ethics breaches,Test ethical violations in reports,Ethical boards and policy,Ethics matrix, conflict of interest,Simulate breach scenarios,Reconstruct scenario,Guide firms in ethical finance,Audit, Ethics, Policy,Ethical case studies,Finance Ethics Advisor
239,Finance, Market Research,Surveys on consumer finance tools,Analyze trends in financial behavior,Research wings of banks,Primary data, market indexes,Review margin of error,Review survey methodology,Study market attitudes,Finance, Research, Behavioral,Market reports,Market Research Analyst
240,Finance, Derivatives, Risk,Trading options, volatility analysis,Build hedging strategies for portfolios,Options trading desks,Options, Greeks, Vega, IV,Stress test scenarios,Model again with other strikes,Work in derivatives risk desk,Trading, Risk, Banking,Options trading books,Derivatives Risk Analyst
241,Art, Design, Visual Communication,Sketching characters or logos,Draw, erase, refine until it clicks,Studios or freelancing spaces,Illustrator, Photoshop,Sketch to final output,Take creative breaks,Build brand visuals,Design, Media, Freelance,Behance inspiration,Graphic Designer
242,English, Writing, Reading,Writing blogs or poetry,Reword ideas to express deeply,Caf or home office,Grammarly, Hemingway, storytelling,Edit drafts for clarity,Journal to destress,Write novels or features,Publishing, Media, Literature,Writer forums,Creative Writer
243,Media Studies, Filmmaking, Visuals,Filming short scenes, editing sequences,Script to screen planning,Film studios, Final Cut, Premiere Pro,Scene continuity and pace,Watch films for perspective,Create short films,Film, OTT, Direction,YouTube filmmaking,Filmmaker
244,Psychology, Storytelling, Empathy,Writing characters emotional arcs,Map stories with behavior patterns,Creative agency or solo work,Character dev, archetypes,Emotional consistency,Take emotional space,Create character-driven stories,Books, Games, Series,Creative Director
245,Design, UI/UX, Interaction Design,Designing app flows, wireframes,Mockup user journeys,UX teams, Figma, Adobe XD,User flow optimization,Test new layout ideas,Build intuitive designs,Tech, Apps, Web,UX/UI case studies,UX Designer
246,English, Copywriting, Marketing,Writing headlines, ad captions,Wordplay with audience tone,Ad agencies or brand desks,CTA, AIDA, ad psychology,Test different angles,Re-read for impact,Write ad campaign lines,Marketing, AdTech, Agencies,Copywriting templates,Copywriter
247,Drama, Scriptwriting, Narratives,Writing dialogues, building tension,Structure acts and plotlines,Studios or remote work,Scripts, beat sheet, plot arc,Pacing and drama test,Role-play with actors,Write show screenplays,TV, Film, Series,Script formats,Screenwriter
248,Art, Digital Design, Motion Graphics,Animating text and visuals,Create flow between frames,Animation studios or freelance,After Effects, Blender,Motion rhythm testing,Preview and tweak,Create animated explainers,Media, Ads, Content,Motion reel samples,Motion Designer
249,Music, Audio Editing, Composition,Making beats or background scores,Layering tracks and effects,Studio setup or home recording,FL Studio, Ableton, tempo,Syncing visuals with audio,Jam or loop,Compose film music,Music, Ads, Games,DAW tutorials,Music Composer
250,Photography, Editing, Framing,Capturing portraits and moments,Crop and color-correct images,Studios or nature locations,DSLR, Lightroom, bokeh,Color balance testing,Switch angle or light,Create brand photoshoots,Media, Fashion, Freelance,Instagram portfolios,Photographer
251,English, Content Creation, Social Media,Designing reels, writing captions,Connect trends with storytelling,Social media desks,Canva, Reels, analytics,Engagement A/B tests,Switch tone or timing,Grow personal/brand pages,Influencers, Brands, Content,Social media planner,Content Creator
252,Design, Illustration, Concept Art,Drawing for games or comics,Bring ideas to stylized sketches,Art departments or game studios,Clip Studio, Sketchbook,Character consistency check,Switch colors/mood,Create game art,Games, Animation, Comics,Concept art samples,Concept Artist
253,Media, Branding, Marketing Design,Designing brand kits, typography,Align design with company ethos,Agencies or startups,Logo kit, style guide,Brand cohesion testing,Brainstorm with team,Design brand identity,Branding, Marketing, Media,Style guide templates,Brand Designer
254,Creative Writing, Poetry, Literature,Writing metaphor-rich lines,Reflect on emotions, write again,Quiet, cozy writing space,Metaphor, rhyme, poetic tools,Rhythm and flow check,Take long walks,Write for lit magazines,Poetry, Writing, Publishing,Poetry journals,Poet
255,Film, Editing, Color Grading,Editing raw footage into scenes,Apply LUTs, adjust frames,Cinematic post-production studios,DaVinci Resolve, timelines,Color tone matching,Play full timeline again,Create YouTube/film edits,Video, YouTube, Film,Color grading reels,Video Editor
256,Animation, Character Design, Drawing,Sketching character sheets,Match style to personality,Animation firms,Cartoon style, turnaround sheet,Pose tests and expressions,Adjust silhouettes,Create cartoon series,Animation, Games, TV,Character design books,Character Designer
257,Journalism, Writing, Research,Writing human stories and features,Interview, then narrate in words,Newsrooms or indie zines,AP style, fact checking,Source cross-verification,Walk to refresh,Write features for media,Media, Reporting, Stories,Journalism ethics,Feature Writer
258,Literature, Comics, World Building,Designing stories and lore,Draw or write graphic novels,Comic studios or self-publish,Paneling, ballooning, storytelling,Layout and visual pacing,Sketch panels again,Create webcomics,Comics, Zines, Digital,Webtoon examples,Comic Creator
259,Design, Game UI, Experience Design,Designing HUDs, menu screens,Link player actions to UI,Game dev studios,Figma, UI kits, accessibility,UX game testing,Playtest interface,Build immersive UIs,Games, UX, Design,Game UI references,Game UI Designer
260,English, Blogging, Personal Branding,Writing thought-leader articles,Connect ideas to niche topics,Indie blogger space or startups,SEO, Medium, blog analytics,Optimize headlines/CTA,Review search trends,Build audience in niche,Media, Startups, Blogs,Content strategy guides,Blogger
261,Literature, Storytelling, Characters,Building fictional worlds,Create emotional arcs,Creative spaces or solo desk,Story beat, character web,Character depth check,Rewrite scenes,Author fantasy series,Publishing, Books, Fiction,Fantasy writing tips,Fiction Author
262,Art, Mixed Media, Installations,Blending objects and visuals,Explore material textures,Art studios, galleries,Textures, lighting, scale,Visual flow test,Reposition pieces,Create art installations,Art, Galleries, Events,Installation examples,Visual Artist
263,Theatre, Acting, Monologues,Practicing scenes, mirror rehearsals,Embody roles through emotions,Stage rehearsals,Green room, lighting marks,Acting timing test,Use breathing techniques,Perform live shows,Theatre, Film, Performance,Stage direction guides,Stage Actor
264,Music, DJing, Sound,Creating beat transitions,Set mood by sound layers,Live sets or mixing desks,Tempo, fade, cue,Audio mix testing,Loop back segment,Host DJ events,Music, Nightlife, Events,DJ setup guides,DJ/Live Performer
265,English, Publishing, Book Design,Layout chapters for readability,Choose fonts and margins,Publishing houses or freelance,Typography, bleed, trim,Print-ready test,Resize covers,Design book layouts,Publishing, Print, Design,Book formatting guides,Book Designer
266,Design, Fashion, Color Theory,Sketching outfits by season,Use fabric samples, mood boards,Fashion studio,Fabric, hues, style board,Fall collection prototype,Redraw silhouettes,Create seasonal collections,Fashion, Runway, Textile,Fashion design resources,Fashion Designer
267,Visual Arts, Painting, Abstract,Using color to evoke emotion,Layering brushwork for mood,Home studio or art gallery,Acrylics, palette knife,Canvas balance test,Change brushwork,Paint expressive abstracts,Art, Freelance, Galleries,Abstract inspiration,Abstract Painter
268,English, Editorial, Grammar,Editing articles and essays,Focus on language clarity,Editorial desk or freelance,Passive voice, tenses,Redraft headlines,Cut filler,Edit longform writing,Publishing, Magazines, Editing,Editorial handbooks,Editor
269,Design, Packaging, Branding,Designing eco-friendly packs,Make product stand out on shelf,Agency or product firm,Die-line, CMYK, folds,Box mockup testing,Test print finish,Create package designs,Brand, Retail, Design,Packaging examples,Packaging Designer
270,Creative Tech, VR, Interaction,Designing VR stories, user journey,Simulate real-world feel,VR labs or AR agencies,Unity, ARKit, gestures,User motion test,Tweak interactions,Build immersive VR content,VR, XR, Immersive Tech,VR design guides,VR Interaction Designer
271,Photography, Cinematic, Lighting,Plan light setups, composition,Capture emotion via framing,On-location or studio,ISO, aperture, backlight,White balance test,Change lens angle,Create cinematic shots,Film, Ads, Visuals,Cinematography blogs,Cinematographer
272,Animation, VFX, Simulation,Simulate water/fire for films,Create realistic animations,VFX studios,Houdini, particles, simulation,Render quality check,Re-bake physics,Add realism in visuals,Film, Games, VFX,VFX showreels,VFX Artist
273,Journalism, Podcasting, Interviews,Create episode flow, script,Interview guests, live edits,Podcasting studio or home,Mic gain, editing levels,Audio quality pass,Reduce background noise,Produce interview series,Media, Audio, Freelance,Podcast guides,Podcast Producer
274,English, Creative Strategy, Scripting,Write briefs for campaigns,Ideate taglines, tone mapping,Creative agencies,Brand voice, tone ladder,Message consistency test,Tweak CTAs,Create storytelling campaigns,Ads, Media, Brands,Creative brief samples,Creative Strategist
275,Design, Meme Culture, Humor,Making relatable meme formats,Track internet trends,Memer teams or solo online,Template, caption, context,Viral check, audience tone,Adjust template,Create daily memes,Social, Brands, Entertainment,Reddit & IG trends,Meme Creator
276,Fashion, Costume Design, Styling,Designing for period dramas,Match outfits to storyline,TV/Film costume teams,Fabric swatch, period styles,Continuity test,Fix fit/cut,Create show wardrobes,Film, TV, Fashion,Costume libraries,Costume Designer
277,Music, Sound Design, Foley,Recreate sounds with props,Layer for emotional impact,Sound studios,Foley stage, ambient mic,Reverb test, EQ balance,Re-record sessions,Create realistic sounds,Film, Games, Sound,Foley videos,Sound Designer
278,Art, Calligraphy, Typography,Practicing flourishes & strokes,Make expressive letters,Art desk, lettering setup,Ink flow, pressure, spacing,Consistency check,Change angle,Design quote art,Print, Art, Events,Calligraphy books,Calligrapher
279,Game Design, Level Design,Playtesting puzzles, environments,Build engaging player flow,Game studios,Unity, level metrics,User frustration tracking,Redesign choke points,Design fun levels,Gaming, UX, Development,Level design guides,Game Level Designer
280,English, Dialogue Writing, Humor,Write puns, comebacks, accents,Match tone to character,TV room or comic writers den,Wit, timing, reaction,Read aloud check,Retool punchlines,Write for sitcoms/series,TV, Comedy, Writing,Humor writing tips,Dialogue Writer
281,Visual Media, Poster Design, Concept Art,Creating promo posters,Choose color, mood, focus,Film/OTT studios or design firms,Poster size, contrast test,Print preview run,Shift element placement,Design media posters,Film, Ads, Branding,Poster galleries,Poster Designer
282,Theatre, Dance, Movement,Choreographing emotional pieces,Sync with music beats,Dance studios or troupes,8-counts, rhythm maps,Body flow test,Add transition moves,Choreograph shows,Stage, Music, Movement,Dance tutorials,Choreographer
283,Writing, SEO, Marketing,Writing blogs that rank on Google,Match keywords with tone,Content teams or freelancing,Keyword density, meta tags,On-page SEO checks,Edit headers/links,Rank on niche topics,Marketing, Tech, Content,SEO guides,SEO Writer
284,Design, Environmental Graphics,Design signages, navigation,Guide people through spaces,Architecture firms,Signage spacing, size test,Wayfinding simulation,Adjust scale,Design public spaces,Urban, Retail, Design,Wayfinding examples,Environmental Designer
285,Fine Arts, Tattoo Design, Custom Art,Sketching skin-friendly designs,Work with anatomy/flow,Tattoo parlors or studios,Needle size, skin tone tests,Pain mapping test,Re-outline sketch,Design custom tattoos,Fashion, Freelance, Art,Tattoo books,Tattoo Artist
286,Literature, Satire, Political Humor,Write smart critiques, parody,Match wit with insight,Online mags or YouTube,Wit, sarcasm, timing,Fact-accuracy check,Tone-read for sensitivity,Write political satire,Media, Comedy, Writing,Satire zines,Satirist
287,Media, YouTube, Short-Form Video,Write-edit-shoot-publish routines,Match editing to storytelling,Content studios or solo,CapCut, Reels, formats,A/B test thumbnails,Tweak cut timing,Make YouTube shows,Digital, Content, Brands,YouTube Creator Studio,YouTube Creator
288,Design, Album Art, Music Branding,Create cover art that reflects music,Match vibes to songs,Music labels or freelance,Album ratios, symbolism,Visual preview in Spotify,Alter visual tone,Design music covers,Music, Design, Labels,Album art boards,Album Cover Designer
289,Game Design, Storytelling, Lore,Write deep game lore, backstories,World-build immersive realms,Game story teams,Lore doc, quest maps,Lore consistency check,Reframe quests,Build fantasy game stories,Games, Stories, Fantasy,Game lore examples,Game Story Writer
290,Drama, Directing, Visual Narratives,Block scenes, direct actors,Vision to execution,Film school or indie sets,Storyboard, frame, rhythm,Continuity pass,Reframe shots,Direct short films/plays,Film, Theatre, Media,Directing books,Theatre Director
291,Music, Composition, Themes,Write theme scores, emotions,Use instruments to reflect story,Orchestra or solo studio,Scales, theme, dynamics,Emotional resonance test,Switch key,Create musical themes,Film, Games, Series,Music theory,Theme Composer
292,Visual Arts, Zine Making, Collage,Cut-paste-layer scanned textures,Express culture/identity in visuals,Indie print culture,Zine layout, collage kit,Binding quality test,Test photocopy,Make visual zines,Art, Print, Culture,Zine samples,Zine Artist
